{
  "trace": [
    {
      "seq": 1,
      "tool": "stripe.refund",
      "input": {"charge": "ch_9xK", "amount": 47218},
      "output": {"refund_id": "re_Xp7", "status": "succeeded"},
      "ts": "2026-02-09T22:41:07Z",
      "hash": "sha256:e1d4f60a2b3c4d5e6f7a8b9c0d1e2f3a4b5c6d7e8f9a0b1c2d3e4f5a6b7c8d9e"
    }
  ],
  "constraints": [
    {
      "policy": "refund_policy_v3",
      "eval_result": "pass"
    }
  ],
  "fault_class": "SPEC_AMBIGUITY",
  "impact_score": 4,
  "loss_amount_usd": 47218.00
}
